{
  "success": true,
  "message": "Recommendations generated successfully",
  "data": {
    "success": true,
    "message": "Recommendations generated successfully",
    "engineVersion": "1.0.0",
    "strategy": "RuleBased",
    "configVersion": "1.0",
    "executionTimeMs": 1.85,
    "productsScanned": 25,
    "productsFiltered": 17,
    "recommendationsReturned": 5,
    "userId": "USR001",
    "generatedAt": "2026-07-31T23:00:00Z",
    "recommendations": [
      {
        "productId": "TS001",
        "name": "Classic Black Crewneck T-Shirt",
        "category": "tshirt",
        "brand": "Urban Wear",
        "price": 799.0,
        "currency": "INR",
        "image": "/assets/products/tshirts/ts001.jpg",
        "rating": 4.5,
        "score": 94.5,
        "reasons": [
          "Matches preferred category (tshirt)",
          "Matches preferred style (casual)",
          "Within your budget",
          "Preferred color (Black)",
          "Favored brand (Urban Wear)",
          "Matches preferred fit (regular)",
          "Available in your size (M, L)",
          "Suitable for coastal climate",
          "Highly rated product (4.5★)"
        ]
      }
    ]
  },
  "timestamp": "2026-07-31T23:00:00Z",
  "requestId": "c3d4e5f6-a7b8-9c0d-1e2f-3a4b5c6d7e8f"
}
